{
  "$schema": "https://json-schema.org/draft/2020-12/schema",
  "$id": "awf.context-snippets.v1",
  "title": "AWF Context Snippets Artifact",
  "type": "object",
  "required": [
    "schema",
    "run_id",
    "task",
    "sources",
    "redactions",
    "created_at"
  ],
  "properties": {
    "schema": { "const": "awf.context-snippets.v1" },
    "run_id": { "type": "string", "minLength": 1 },
    "task": { "type": "string", "minLength": 1 },
    "sources": {
      "type": "array",
      "minItems": 1,
      "items": {
        "type": "object",
        "required": ["path", "lines", "reason", "summary"],
        "properties": {
          "path": { "type": "string", "minLength": 1 },
          "lines": { "type": "string", "minLength": 1 },
          "reason": { "type": "string", "minLength": 1 },
          "summary": { "type": "string", "minLength": 1 }
        },
        "additionalProperties": true
      }
    },
    "redactions": { "type": "array" },
    "created_at": { "type": "string", "minLength": 1 }
  },
  "additionalProperties": true
}
