{
  "schema": "awf.context-snippets.v1",
  "run_id": "20260528-claudekit-advanced-mechanisms",
  "task": "Implement rationalization prevention, task hydration, plan review gate, and strict wiki lint",
  "sources": [
    {
      "path": ".planning/STATE.md",
      "lines": "1-35",
      "reason": "repo preflight",
      "summary": "Template state and previous ClaudeKit artifact-gate work were loaded before implementation."
    },
    {
      "path": ".agent/agents/orchestrator.md",
      "lines": "1-130",
      "reason": "repo preflight",
      "summary": "Orchestrator requires artifact ownership and checklist validation for non-trivial work."
    },
    {
      "path": ".agent/scripts/checklist.py",
      "lines": "1-280",
      "reason": "artifact and review gate integration",
      "summary": "Checklist validates required JSON artifacts and now enforces wiki lint and reviewer scores."
    },
    {
      "path": ".agent/scripts/wiki_lint.py",
      "lines": "1-220",
      "reason": "strict wiki gate",
      "summary": "Wiki lint now supports strict, changed, and JSON modes."
    },
    {
      "path": "tests/rationalization-table.test.ts",
      "lines": "1-60",
      "reason": "TDD evidence",
      "summary": "Test verifies the rule file, workflow references, and schema field exist."
    }
  ],
  "redactions": [],
  "created_at": "2026-05-28T10:20:00+07:00"
}
