{
  "schema": "awf.context-snippets.v1",
  "run_id": "20260528-harness-integration-plan",
  "task": "Plan Session Checkpointing and Git Worktree Runner integration",
  "sources": [
    {
      "path": ".planning/STATE.md",
      "lines": "1-52",
      "reason": "current project state and recent harness evaluation",
      "summary": "AWF is ready, artifact guardrails are implemented, and prior evaluation recommends lightweight checkpoints plus worktree runner primitives."
    },
    {
      "path": "docs/wiki-index.md",
      "lines": "1-22",
      "reason": "knowledge wiki navigation",
      "summary": "No direct wiki page exists for harness integration; Obsidian graph scan returned no docs for this concept."
    },
    {
      "path": ".agent/agents/orchestrator.md",
      "lines": "1-244",
      "reason": "orchestration routing and artifact ownership baseline",
      "summary": "Orchestrator already requires context, recall, GitNexus where available, artifact ownership, and explicit sub-agent scope."
    },
    {
      "path": ".agent/scripts/session_manager.py",
      "lines": "1-55",
      "reason": "current session state implementation",
      "summary": "Existing script only saves/restores a simple .planning/session.json snapshot and needs a run-scoped checkpoint model."
    },
    {
      "path": ".agent/scripts/checklist.py",
      "lines": "1-269",
      "reason": "artifact gate behavior to reuse",
      "summary": "Checklist validates five approval artifacts, reviewer scores, rationalization checks, and credential-like values."
    },
    {
      "path": ".gitignore",
      "lines": "1-43",
      "reason": "runtime file hygiene",
      "summary": ".tmp is already ignored, which makes .tmp/worktrees suitable for isolated git worktrees; .agent/checkpoints should be added."
    }
  ],
  "redactions": [],
  "created_at": "2026-05-28T00:00:00+07:00"
}
