{
  "schema": "awf.context-snippets.v1",
  "run_id": "20260528-claudekit-integration",
  "task": "Implement ClaudeKit artifact-gated guardrails",
  "sources": [
    {
      "path": "docs/plans/claudekit-integration-plan.md",
      "lines": "1-260",
      "reason": "implementation contract and task list",
      "summary": "Plan requires five JSON artifacts, checklist enforcement, workflow upgrades, and aligned repo rules."
    },
    {
      "path": ".agent/scripts/checklist.py",
      "lines": "1-80",
      "reason": "validator baseline before implementation",
      "summary": "Checklist originally ran lint, typecheck, tests, and env parity without artifact validation."
    },
    {
      "path": ".agent/workflows/debug.md",
      "lines": "1-60",
      "reason": "debug workflow baseline",
      "summary": "Debug workflow had reproduce, isolate, root cause, fix, and learn phases but no mandatory Scout and Diagnose gate."
    },
    {
      "path": ".agent/workflows/plan.md",
      "lines": "1-50",
      "reason": "planning workflow baseline",
      "summary": "Planning workflow created task breakdowns but did not require the five-part contract or fast-mode contract."
    },
    {
      "path": ".agent/workflows/code.md",
      "lines": "1-70",
      "reason": "coding workflow baseline",
      "summary": "Code workflow required TDD and checks but did not block implementation on validated plan and risk artifacts."
    }
  ],
  "redactions": [],
  "created_at": "2026-05-28T09:10:00+07:00"
}
